[
  {
    "record_id": "chanterelle",
    "scientific_name": "Cantharellus cibarius",
    "common_name": "Chanterelle",
    "region": "Central Europe",
    "ecological_guild": "Mycorrhizal",
    "taxonomic_group": "Cantharellales",
    "functional_group": "Choice Edible",
    "season_window": ["Summer", "Autumn"],
    "color_group": "Yellow/Gold",
    "image_asset_id": "chanterelle.jpg",
    "image_license": "CC BY-SA 3.0",
    "image_attribution": "Wikimedia Commons, Strobilomyces",
    "source_provenance": ["https://commons.wikimedia.org/wiki/File:Cantharellus_cibarius_cropped.jpg"]
  },
  {
    "record_id": "fly-agaric",
    "scientific_name": "Amanita muscaria",
    "common_name": "Fly Agaric",
    "region": "Central Europe",
    "ecological_guild": "Mycorrhizal",
    "taxonomic_group": "Agaricales",
    "functional_group": "Toxic",
    "season_window": ["Autumn"],
    "color_group": "Red/Orange",
    "image_asset_id": "fly-agaric.jpg",
    "image_license": "CC BY-SA 3.0",
    "image_attribution": "Wikimedia Commons, Onderwijsgek",
    "source_provenance": ["https://commons.wikimedia.org/wiki/File:Amanita_muscaria_3_vliegenzwammen_op_rij.jpg"]
  },
  {
    "record_id": "king-bolete",
    "scientific_name": "Boletus edulis",
    "common_name": "King Bolete",
    "region": "Central Europe",
    "ecological_guild": "Mycorrhizal",
    "taxonomic_group": "Boletales",
    "functional_group": "Choice Edible",
    "season_window": ["Summer", "Autumn"],
    "color_group": "Brown/Tan",
    "image_asset_id": "king-bolete.jpg",
    "image_license": "CC BY-SA 3.0",
    "image_attribution": "Wikimedia Commons, George Chernilevsky",
    "source_provenance": ["https://commons.wikimedia.org/wiki/File:Boletus_edulis_EtsyB.jpg"]
  },
  {
    "record_id": "oyster",
    "scientific_name": "Pleurotus ostreatus",
    "common_name": "Oyster Mushroom",
    "region": "Central Europe",
    "ecological_guild": "Saprotrophic",
    "taxonomic_group": "Agaricales",
    "functional_group": "Choice Edible",
    "season_window": ["Autumn", "Winter"],
    "color_group": "White/Cream",
    "image_asset_id": "oyster.jpg",
    "image_license": "CC BY-SA 3.0",
    "image_attribution": "Wikimedia Commons, Tocekas",
    "source_provenance": ["https://commons.wikimedia.org/wiki/File:Pleurotus_ostreatus_JPG7.jpg"]
  },
  {
    "record_id": "shiitake",
    "scientific_name": "Lentinula edodes",
    "common_name": "Shiitake",
    "region": "East Asia / Cultivated worldwide",
    "ecological_guild": "Saprotrophic",
    "taxonomic_group": "Agaricales",
    "functional_group": "Choice Edible",
    "season_window": ["Autumn"],
    "color_group": "Brown/Tan",
    "image_asset_id": "shiitake.jpg",
    "image_license": "CC0 1.0",
    "image_attribution": "Wikimedia Commons, Frankenstoen",
    "source_provenance": ["https://commons.wikimedia.org/wiki/File:Shiitakegrowing.jpg"]
  },
  {
    "record_id": "turkey-tail",
    "scientific_name": "Trametes versicolor",
    "common_name": "Turkey Tail",
    "region": "Central Europe",
    "ecological_guild": "Saprotrophic",
    "taxonomic_group": "Polyporales",
    "functional_group": "Medicinal",
    "season_window": ["Autumn", "Winter"],
    "color_group": "Brown/Tan",
    "image_asset_id": "turkey-tail.jpg",
    "image_license": "CC BY-SA 3.0",
    "image_attribution": "Wikimedia Commons, Björn S...",
    "source_provenance": ["https://commons.wikimedia.org/wiki/File:Trametes_versicolor_G4.jpg"]
  },
  {
    "record_id": "honey-fungus",
    "scientific_name": "Armillaria mellea",
    "common_name": "Honey Fungus",
    "region": "Central Europe",
    "ecological_guild": "Parasitic",
    "taxonomic_group": "Agaricales",
    "functional_group": "Inedible",
    "season_window": ["Autumn"],
    "color_group": "Yellow/Gold",
    "image_asset_id": "honey-fungus.jpg",
    "image_license": "CC BY-SA 3.0",
    "image_attribution": "Wikimedia Commons, Stu's Images",
    "source_provenance": ["https://commons.wikimedia.org/wiki/File:Armillaria_mellea.jpg"]
  },
  {
    "record_id": "chaga",
    "scientific_name": "Inonotus obliquus",
    "common_name": "Chaga",
    "region": "Northern Europe",
    "ecological_guild": "Parasitic",
    "taxonomic_group": "Hymenochaetales",
    "functional_group": "Medicinal",
    "season_window": ["Winter"],
    "color_group": "Brown/Tan",
    "image_asset_id": "chaga.jpg",
    "image_license": "CC BY-SA 4.0",
    "image_attribution": "Wikimedia Commons, Tocekas",
    "source_provenance": ["https://commons.wikimedia.org/wiki/File:Inonotus_obliquus.jpg"]
  },
  {
    "record_id": "cordyceps",
    "scientific_name": "Cordyceps militaris",
    "common_name": "Cordyceps",
    "region": "Northern Hemisphere",
    "ecological_guild": "Parasitic",
    "taxonomic_group": "Hypocreales",
    "functional_group": "Medicinal",
    "season_window": ["Summer", "Autumn"],
    "color_group": "Red/Orange",
    "image_asset_id": "cordyceps.jpg",
    "image_license": "CC BY-SA 3.0",
    "image_attribution": "Wikimedia Commons, Dan Molter",
    "source_provenance": ["https://commons.wikimedia.org/wiki/File:Cordyceps_militaris.jpg"]
  },
  {
    "record_id": "morel",
    "scientific_name": "Morchella esculenta",
    "common_name": "Morel",
    "region": "Central Europe",
    "ecological_guild": "Mycorrhizal",
    "taxonomic_group": "Pezizales",
    "functional_group": "Choice Edible",
    "season_window": ["Spring"],
    "color_group": "Brown/Tan",
    "image_asset_id": "morel.jpg",
    "image_license": "CC BY-SA 3.0",
    "image_attribution": "Wikimedia Commons, Peter Kudlacek",
    "source_provenance": ["https://commons.wikimedia.org/wiki/File:Morchella_esculenta_growing.jpg"]
  },
  {
    "record_id": "death-cap",
    "scientific_name": "Amanita phalloides",
    "common_name": "Death Cap",
    "region": "Central Europe",
    "ecological_guild": "Mycorrhizal",
    "taxonomic_group": "Agaricales",
    "functional_group": "Toxic",
    "season_window": ["Autumn"],
    "color_group": "White/Cream",
    "image_asset_id": "death-cap.jpg",
    "image_license": "CC BY-SA 3.0",
    "image_attribution": "Wikimedia Commons, Archenzo",
    "source_provenance": ["https://commons.wikimedia.org/wiki/File:Amanita_phalloides_1.JPG"]
  },
  {
    "record_id": "reishi",
    "scientific_name": "Ganoderma lucidum",
    "common_name": "Reishi",
    "region": "East Asia / Cultivated worldwide",
    "ecological_guild": "Saprotrophic",
    "taxonomic_group": "Polyporales",
    "functional_group": "Medicinal",
    "season_window": ["Summer", "Autumn"],
    "color_group": "Red/Orange",
    "image_asset_id": "reishi.jpg",
    "image_license": "CC BY-SA 3.0",
    "image_attribution": "Wikimedia Commons, Eric Steinert",
    "source_provenance": ["https://commons.wikimedia.org/wiki/File:Ganoderma_lucidum_01.jpg"]
  }
]
